{
  "$schema": "http://json-schema.org/draft-07/schema#",
  "$id": "https://github.com/OpenCoven/familiar-contract/schemas/familiar-embodiment-revocation.schema.json",
  "title": "Familiar Embodiment Post-Commit Revocation v1",
  "description": "An append-only signed event that records revocation after an immutable embodiment binding commit.",
  "type": "object",
  "additionalProperties": false,
  "required": ["profile", "schemaVersion", "revocationId", "bindingId", "bindingDigest", "familiarRootId", "identityRevisionId", "revokedAt", "reasonCode", "integrity", "authentication"],
  "properties": {
    "profile": { "const": "familiar.embodiment_revocation.v1" },
    "schemaVersion": { "const": "1.0.0" },
    "revocationId": { "$ref": "#/definitions/opaqueId" },
    "bindingId": { "type": "string", "minLength": 1 },
    "bindingDigest": { "$ref": "#/definitions/hash" },
    "familiarRootId": { "$ref": "#/definitions/opaqueId" },
    "identityRevisionId": { "$ref": "#/definitions/opaqueId" },
    "revokedAt": { "$ref": "#/definitions/timestamp" },
    "reasonCode": { "type": "string", "pattern": "^[a-z][a-z0-9-]*$" },
    "integrity": {
      "type": "object",
      "additionalProperties": false,
      "required": ["algorithm", "canonicalization", "eventDigest"],
      "properties": {
        "algorithm": { "const": "sha-256" },
        "canonicalization": { "const": "jcs-rfc8785" },
        "eventDigest": { "$ref": "#/definitions/hash" }
      }
    },
    "authentication": { "$ref": "#/definitions/authentication" }
  },
  "definitions": {
    "opaqueId": { "type": "string", "pattern": "^[a-z][a-z0-9_-]*:[A-Za-z0-9._:-]+$" },
    "timestamp": { "type": "string", "pattern": "^\\d{4}-\\d{2}-\\d{2}T\\d{2}:\\d{2}:\\d{2}(?:\\.\\d{1,3})?(?:Z|[+-]\\d{2}:\\d{2})$" },
    "hash": { "type": "string", "pattern": "^[0-9a-f]{64}$" },
    "authentication": {
      "type": "object",
      "additionalProperties": false,
      "required": ["method", "signerId", "publicKey", "signature"],
      "properties": {
        "method": { "const": "ed25519" },
        "signerId": { "$ref": "#/definitions/opaqueId" },
        "publicKey": { "type": "string", "pattern": "^[A-Za-z0-9+/]+={0,2}$" },
        "signature": { "type": "string", "pattern": "^[A-Za-z0-9+/]+={0,2}$" }
      }
    }
  }
}
